{
  "schemaVersion": "1.0.0",
  "draftId": "draft:packet:108:1-3:revision:1",
  "packetId": "packet:108:1-3",
  "sourceFingerprint": "805f6f1c0eda9f6b8e30bf5ff4bd92ae03d436466b2ee152e7a31d2f8bffbdec",
  "knowledgeSnapshot": {
    "snapshotId": "ffabdaa3cda73da9c03837131ceabaec2ba348914404725cb0d4b7eebd74fcff",
    "version": "1.0.0",
    "files": [
      {
        "path": "content-authoring/production-knowledge/knowledge-version.json",
        "checksum": "31aedfc7a9316f665ca3b37bdfe8fd80010047315033b5e4fca0f4561fd9e681"
      },
      {
        "path": "content-authoring/production-knowledge/learner-context/form-families.json",
        "checksum": "2ba13ff2e862b39cf955c459e1d15dbde29a1e05f548b7f0a2a817cd35907294"
      },
      {
        "path": "content-authoring/production-knowledge/learner-context/grammar-concepts.json",
        "checksum": "7a950597fde0abb1cdcfc1f2f8cb8e1a2e9124aa584c823865f74c25258dabc2"
      },
      {
        "path": "content-authoring/production-knowledge/learner-context/particles.json",
        "checksum": "44b87ade17fc3e43d15ff22384f509ca74a0fa2ec36212bb0c6fb27e5c81b818"
      },
      {
        "path": "content-authoring/production-knowledge/learner-context/terminology.json",
        "checksum": "b0cabd6b4ad77f3c569572eca1982d289d6a40afc6b26078edb4e34cda42b0c4"
      },
      {
        "path": "content-authoring/production-knowledge/lexical-registry/occurrence-exceptions.json",
        "checksum": "68cc21608704da4e28ff5a6a1ad76b4104868b91d711c1212be4af48aa9684f9"
      },
      {
        "path": "content-authoring/production-knowledge/lexical-registry/shared-lessons.json",
        "checksum": "68cc21608704da4e28ff5a6a1ad76b4104868b91d711c1212be4af48aa9684f9"
      },
      {
        "path": "content-authoring/production-knowledge/safeguards/common-problems.json",
        "checksum": "ba934a2cfaf24171b31167f05d1527cbc276bb459cd050cf0a01c89c12a8cb9a"
      },
      {
        "path": "content-authoring/production-knowledge/safeguards/reviewer-rules.json",
        "checksum": "cb1dd530f2da3dec8165d65cca48b5b72e00c1b2aef28cab467c82bdf5c9149f"
      },
      {
        "path": "content-authoring/production-knowledge/safeguards/source-policy.json",
        "checksum": "be859c8cca897ed1d186816bdd591460ab20922084550466de34132647770dda"
      },
      {
        "path": "content-import/sources/qac/morphology-overrides.json",
        "checksum": "c70b8010c2b5f7df042967c0374af3b4c4b7f4c179f133c4e61ab021c1481f64"
      }
    ]
  },
  "revision": 1,
  "status": "draft",
  "createdBy": "content-factory",
  "ayahs": [
    {
      "ayahId": "ayah:108:1",
      "ayahLayers": {},
      "words": [
        {
          "wordId": "word:108:1:1",
          "layers": {
            "breakdownScope": "shared"
          },
          "layerState": {
            "segmentation": "pending",
            "morphology": "pending",
            "grammar": "pending",
            "meaning": "pending",
            "learnerConnections": "pending",
            "pedagogy": "pending"
          }
        },
        {
          "wordId": "word:108:1:2",
          "layers": {
            "breakdownScope": "shared"
          },
          "layerState": {
            "segmentation": "pending",
            "morphology": "pending",
            "grammar": "pending",
            "meaning": "pending",
            "learnerConnections": "pending",
            "pedagogy": "pending"
          }
        },
        {
          "wordId": "word:108:1:3",
          "layers": {
            "breakdownScope": "shared"
          },
          "layerState": {
            "segmentation": "pending",
            "morphology": "pending",
            "grammar": "pending",
            "meaning": "pending",
            "learnerConnections": "pending",
            "pedagogy": "pending"
          }
        }
      ]
    },
    {
      "ayahId": "ayah:108:2",
      "ayahLayers": {},
      "words": [
        {
          "wordId": "word:108:2:1",
          "layers": {
            "breakdownScope": "shared"
          },
          "layerState": {
            "segmentation": "pending",
            "morphology": "pending",
            "grammar": "pending",
            "meaning": "pending",
            "learnerConnections": "pending",
            "pedagogy": "pending"
          }
        },
        {
          "wordId": "word:108:2:2",
          "layers": {
            "breakdownScope": "shared"
          },
          "layerState": {
            "segmentation": "pending",
            "morphology": "pending",
            "grammar": "pending",
            "meaning": "pending",
            "learnerConnections": "pending",
            "pedagogy": "pending"
          }
        },
        {
          "wordId": "word:108:2:3",
          "layers": {
            "breakdownScope": "shared"
          },
          "layerState": {
            "segmentation": "pending",
            "morphology": "pending",
            "grammar": "pending",
            "meaning": "pending",
            "learnerConnections": "pending",
            "pedagogy": "pending"
          }
        }
      ]
    },
    {
      "ayahId": "ayah:108:3",
      "ayahLayers": {},
      "words": [
        {
          "wordId": "word:108:3:1",
          "layers": {
            "breakdownScope": "shared"
          },
          "layerState": {
            "segmentation": "pending",
            "morphology": "pending",
            "grammar": "pending",
            "meaning": "pending",
            "learnerConnections": "pending",
            "pedagogy": "pending"
          }
        },
        {
          "wordId": "word:108:3:2",
          "layers": {
            "breakdownScope": "shared"
          },
          "layerState": {
            "segmentation": "pending",
            "morphology": "pending",
            "grammar": "pending",
            "meaning": "pending",
            "learnerConnections": "pending",
            "pedagogy": "pending"
          }
        },
        {
          "wordId": "word:108:3:3",
          "layers": {
            "breakdownScope": "shared"
          },
          "layerState": {
            "segmentation": "pending",
            "morphology": "pending",
            "grammar": "pending",
            "meaning": "pending",
            "learnerConnections": "pending",
            "pedagogy": "pending"
          }
        },
        {
          "wordId": "word:108:3:4",
          "layers": {
            "breakdownScope": "shared"
          },
          "layerState": {
            "segmentation": "pending",
            "morphology": "pending",
            "grammar": "pending",
            "meaning": "pending",
            "learnerConnections": "pending",
            "pedagogy": "pending"
          }
        }
      ]
    }
  ]
}
